uc1 :- Ability to create a payroll service database
====================================================

mysql> Create Database Payroll_Service;
Query OK, 1 row affected (0.00 sec)

mysql> show databases;
+--------------------+
| Database           |
+--------------------+
| information_schema |
| mysql              |
| payroll_service    |
| performance_schema |
| sakila             |
| sys                |
| world              |
+--------------------+
7 rows in set (0.00 sec)


------------------------------------------------------------------------------------------------


UC2 :- Ability to create a employee payroll table in the payroll service database to
manage employee payrolls.
================================================================================================

mysql> use payroll_service;
Database changed
mysql> create table employee_payroll(
    -> id INT unsigned NOT NULL AUTO_INCREMENT,
    -> name VARCHAR(15) NOT NULL,
    ->  salary Double NOT NULL,
    -> start DATE NOT NULL,
    -> PRIMARY KEY(id));
Query OK, 0 rows affected (0.03 sec)

mysql> show tables;
+---------------------------+
| Tables_in_payroll_service |
+---------------------------+
| employee_payroll          |
+---------------------------+
1 row in set (0.00 sec)

mysql> desc employee_payroll;
+--------+--------------+------+-----+---------+----------------+
| Field  | Type         | Null | Key | Default | Extra          |
+--------+--------------+------+-----+---------+----------------+
| id     | int unsigned | NO   | PRI | NULL    | auto_increment |
| name   | varchar(15)  | NO   |     | NULL    |                |
| salary | double       | NO   |     | NULL    |                |
| start  | date         | NO   |     | NULL    |                |
+--------+--------------+------+-----+---------+----------------+
4 rows in set (0.01 sec)


---------------------------------------------------------------------------------------------------

UC3 :- Ability to create employee payroll data in the payroll service database as 
part of CRUD Operation - Use payroll_service database.

====================================================================================================

mysql> insert into Employee_payroll(name,salary,start)values
    -> ('Mansi','40000.00','2022-09-10'),
    -> ('Shivani','30000.00','2021-08-24'),
    -> ('Surabhi','50000','2023-01-15');
Query OK, 3 rows affected (0.02 sec)
Records: 3  Duplicates: 0  Warnings: 0

mysql> select * from employee_payroll;
+----+---------+--------+------------+
| id | name    | salary | start      |
+----+---------+--------+------------+
|  1 | Mansi   |  40000 | 2022-09-10 |
|  2 | Shivani |  30000 | 2021-08-24 |
|  3 | Surabhi |  50000 | 2023-01-15 |
+----+---------+--------+------------+
3 rows in set (0.00 sec)


-----------------------------------------------------------------------------------------------------

<<<<<<< uc4_RetrieveAllTheEmployee

uc4 :- Ability to retrieve all the employee payroll data that 
is added to payroll service database.

=======================================================================================================

mysql> select * from employee_payroll;
+----+---------+--------+------------+
| id | name    | salary | start      |
+----+---------+--------+------------+
|  1 | Mansi   |  40000 | 2022-09-10 |
|  2 | Shivani |  30000 | 2021-08-24 |
|  3 | Surabhi |  50000 | 2023-01-15 |
+----+---------+--------+------------+
3 rows in set (0.00 sec)

-------------------------------------------------------------------------------------------------------

UC5 :- Ability to retrieve salary data for a particular employee as well as all employees who 
have joined in a particular data range from the payroll service database.

=====================================================================================================

mysql> select * from employee_payroll where name = 'Surabhi';
+----+---------+--------+------------+
| id | name    | salary | start      |
+----+---------+--------+------------+
|  3 | Surabhi |  50000 | 2023-01-15 |
+----+---------+--------+------------+
1 row in set (0.00 sec)

mysql> select * from Employee_Payroll where start between cast('2022-01-01' as DATE) and DATE(NOW());
+----+---------+--------+------------+
| id | name    | salary | start      |
+----+---------+--------+------------+
|  1 | Mansi   |  40000 | 2022-09-10 |
|  3 | Surabhi |  50000 | 2023-01-15 |
+----+---------+--------+------------+
2 rows in set (0.00 sec)

-------------------------------------------------------------------------------------------------------

UC6 :- Ability to find sum, average, min,max and number of male 
and female employees.

=========================================================================================================

 mysql> insert into Employee_Payroll(name,salary,start)values
    -> ('Ankush','35000.00','2019-07-20');
Query OK, 1 row affected (0.01 sec)

mysql> select * from employee_payroll;
+----+---------+--------+------------+
| id | name    | salary | start      |
+----+---------+--------+------------+
|  1 | Mansi   |  40000 | 2022-09-10 |
|  2 | Shivani |  30000 | 2021-08-24 |
|  3 | Surabhi |  50000 | 2023-01-15 |
|  4 | Ankush  |  35000 | 2019-07-20 |
+----+---------+--------+------------+
4 rows in set (0.00 sec)

mysql> alter table Employee_Payroll add gender VARCHAR(6) after name;
Query OK, 0 rows affected (0.02 sec)
Records: 0  Duplicates: 0  Warnings: 0

mysql>  update Employee_Payroll set gender = 'Female' where name = 'Mansi' o
r name = 'Shivani' or name = 'Surabhi';
Query OK, 3 rows affected (0.00 sec)
Rows matched: 3  Changed: 3  Warnings: 0

mysql>  update Employee_Payroll set gender = 'Male' where  name = 'Ankush';
Query OK, 1 row affected (0.00 sec)
Rows matched: 1  Changed: 1  Warnings: 0

mysql> select * from employee_payroll;
+----+---------+--------+--------+------------+
| id | name    | gender | salary | start      |
+----+---------+--------+--------+------------+
|  1 | Mansi   | Female |  40000 | 2022-09-10 |
|  2 | Shivani | Female |  30000 | 2021-08-24 |
|  3 | Surabhi | Female |  50000 | 2023-01-15 |
|  4 | Ankush  | Male   |  35000 | 2019-07-20 |
+----+---------+--------+--------+------------+
4 rows in set (0.00 sec)

--------------------------------------------------------------------------------------------------------

UC7:- Ability to find sum, average, min,max and number of male 
and female employees.

=========================================================================================================

select * from employee_payroll' at line 1
mysql>  select SUM(salary) from Employee_Payroll
    ->  where gender = 'Female' GROUP BY gender;
+-------------+
| SUM(salary) |
+-------------+
|      120000 |
+-------------+
1 row in set (0.00 sec)

mysql>  select SUM(salary) from Employee_Payroll
    -> where gender = 'Male' GROUP BY gender;
+-------------+
| SUM(salary) |
+-------------+
|       35000 |
+-------------+
1 row in set (0.00 sec)

mysql>  select AVG(salary) from Employee_Payroll
    ->  GROUP BY gender;
+-------------+
| AVG(salary) |
+-------------+
|       40000 |
|       35000 |
+-------------+
2 rows in set (0.00 sec)

mysql> select MIN(salary) from Employee_Payroll GROUP BY gender;
+-------------+
| MIN(salary) |
+-------------+
|       30000 |
|       35000 |
+-------------+
2 rows in set (0.00 sec)

mysql> select MAX(salary) from Employee_Payroll GROUP BY gender;
+-------------+
| MAX(salary) |
+-------------+
|       50000 |
|       35000 |
+-------------+
2 rows in set (0.00 sec)

mysql> select COUNT(id) from Employee_Payroll GROUP BY gender;
+-----------+
| COUNT(id) |
+-----------+
|         3 |
|         1 |
+-----------+
2 rows in set (0.00 sec)

----------------------------------------------------------------------------------------------------------

UC8 :- Ability to extend employee_payroll data to store  employee information like employee phone, 
address and department.

=======================================================================================================


mysql> select * from employee_payroll;
+----+---------+--------+--------+------------+
| id | name    | gender | salary | start      |
+----+---------+--------+--------+------------+
|  1 | Mansi   | Female |  40000 | 2022-09-10 |
|  2 | Shivani | Female |  30000 | 2021-08-24 |
|  3 | Surabhi | Female |  50000 | 2023-01-15 |
|  4 | Ankush  | Male   |  35000 | 2019-07-20 |
+----+---------+--------+--------+------------+
4 rows in set (0.01 sec)

mysql>  alter table employee_payroll
    ->  add phoneNumber INT(10) after name;
Query OK, 0 rows affected, 1 warning (0.02 sec)
Records: 0  Duplicates: 0  Warnings: 1

mysql> alter table employee_payroll
    ->  add address Varchar(20) NOT NULL after PhoneNumber;
Query OK, 0 rows affected (0.01 sec)
Records: 0  Duplicates: 0  Warnings: 0

mysql> alter table employee_payroll
    ->  add department Varchar(20) NOT NULL after Address;
Query OK, 0 rows affected (0.01 sec)
Records: 0  Duplicates: 0  Warnings: 0

mysql>  alter table employee_payroll
    -> alter address SET DEFAULT 'Bramhapuri';
Query OK, 0 rows affected (0.01 sec)
Records: 0  Duplicates: 0  Warnings: 0

mysql> desc employee_payroll;
+-------------+--------------+------+-----+------------+----------------+
| Field       | Type         | Null | Key | Default    | Extra          |
+-------------+--------------+------+-----+------------+----------------+
| id          | int unsigned | NO   | PRI | NULL       | auto_increment |
| name        | varchar(15)  | NO   |     | NULL       |                |
| phoneNumber | int          | YES  |     | NULL       |                |
| address     | varchar(20)  | NO   |     | Bramhapuri |                |
| department  | varchar(20)  | NO   |     | NULL       |                |
| gender      | varchar(6)   | YES  |     | NULL       |                |
| salary      | double       | NO   |     | NULL       |                |
| start       | date         | NO   |     | NULL       |                |
+-------------+--------------+------+-----+------------+----------------+
8 rows in set (0.01 sec)

mysql> select * from employee_payroll;
+----+---------+-------------+---------+------------+--------+--------+------------+
| id | name    | phoneNumber | address | department | gender | salary | start      |
+----+---------+-------------+---------+------------+--------+--------+------------+
|  1 | Mansi   |        NULL |         |            | Female |  40000 | 2022-09-10 |
|  2 | Shivani |        NULL |         |            | Female |  30000 | 2021-08-24 |
|  3 | Surabhi |        NULL |         |            | Female |  50000 | 2023-01-15 |
|  4 | Ankush  |        NULL |         |            | Male   |  35000 | 2019-07-20 |
+----+---------+-------------+---------+------------+--------+--------+------------+
4 rows in set (0.00 sec)

mysql> alter table employee_payroll
    ->  modify phonenumber
    -> Varchar(20);
Query OK, 4 rows affected (0.02 sec)
Records: 4  Duplicates: 0  Warnings: 0

mysql> update employee_payroll set phonenumber = '9765935131'
    ->  where name = 'Mansi';
Query OK, 1 row affected (0.00 sec)
Rows matched: 1  Changed: 1  Warnings: 0

mysql> update employee_payroll set phonenumber = '9765940347'
    ->  where name = 'shivani';
Query OK, 1 row affected (0.00 sec)
Rows matched: 1  Changed: 1  Warnings: 0

mysql> update employee_payroll set phonenumber = '9421869425'
    ->  where name = 'Surabhi';
Query OK, 1 row affected (0.00 sec)
Rows matched: 1  Changed: 1  Warnings: 0

mysql> update employee_payroll set phonenumber = '9634069359'
    ->  where name = 'Ankush';
Query OK, 1 row affected (0.00 sec)
Rows matched: 1  Changed: 1  Warnings: 0

mysql> select * from employee_payroll;
+----+---------+-------------+---------+------------+--------+--------+------------+
| id | name    | phonenumber | address | department | gender | salary | start      |
+----+---------+-------------+---------+------------+--------+--------+------------+
|  1 | Mansi   | 9765935131  |         |            | Female |  40000 | 2022-09-10 |
|  2 | Shivani | 9765940347  |         |            | Female |  30000 | 2021-08-24 |
|  3 | Surabhi | 9421869425  |         |            | Female |  50000 | 2023-01-15 |
|  4 | Ankush  | 9634069359  |         |            | Male   |  35000 | 2019-07-20 |
+----+---------+-------------+---------+------------+--------+--------+------------+
4 rows in set (0.00 sec)

mysql> update employee_payroll set address = 'Bramhapuri'
    ->  where name = 'Mansi' or name = 'Shivani' or name = 'Surabhi' or name = 'Ankush';
Query OK, 4 rows affected (0.00 sec)
Rows matched: 4  Changed: 4  Warnings: 0

mysql> select * from employee_payroll;
+----+---------+-------------+------------+------------+--------+--------+------------+
| id | name    | phonenumber | address    | department | gender | salary | start      |
+----+---------+-------------+------------+------------+--------+--------+------------+
|  1 | Mansi   | 9765935131  | Bramhapuri |            | Female |  40000 | 2022-09-10 |
|  2 | Shivani | 9765940347  | Bramhapuri |            | Female |  30000 | 2021-08-24 |
|  3 | Surabhi | 9421869425  | Bramhapuri |            | Female |  50000 | 2023-01-15 |
|  4 | Ankush  | 9634069359  | Bramhapuri |            | Male   |  35000 | 2019-07-20 |
+----+---------+-------------+------------+------------+--------+--------+------------+
4 rows in set (0.00 sec)

mysql> update employee_payroll set department = 'Devops Engineer'
    -> where name = 'Mansi';
Query OK, 1 row affected (0.00 sec)
Rows matched: 1  Changed: 1  Warnings: 0

mysql> update employee_payroll set department = 'Design Engineer'
    -> where name = 'shivani';
Query OK, 1 row affected (0.00 sec)
Rows matched: 1  Changed: 1  Warnings: 0

mysql> update employee_payroll set department = 'Manual Testing'
    -> where name = 'Surabhi';
Query OK, 1 row affected (0.00 sec)
Rows matched: 1  Changed: 1  Warnings: 0

mysql> update employee_payroll set department = 'Python Developer'
    -> where name = 'Ankush';
Query OK, 1 row affected (0.00 sec)
Rows matched: 1  Changed: 1  Warnings: 0

mysql> select * from employee_payroll;
+----+---------+-------------+------------+------------------+--------+--------+------------+
| id | name    | phonenumber | address    | department       | gender | salary | start      |
+----+---------+-------------+------------+------------------+--------+--------+------------+
|  1 | Mansi   | 9765935131  | Bramhapuri | Devops Engineer  | Female |  40000 | 2022-09-10 |
|  2 | Shivani | 9765940347  | Bramhapuri | Design Engineer  | Female |  30000 | 2021-08-24 |
|  3 | Surabhi | 9421869425  | Bramhapuri | Manual Testing   | Female |  50000 | 2023-01-15 |
|  4 | Ankush  | 9634069359  | Bramhapuri | Python Developer | Male   |  35000 | 2019-07-20 |
+----+---------+-------------+------------+------------------+--------+--------+------------+
4 rows in set (0.00 sec)




