uc1 :- Ability to create a payroll service database
====================================================

mysql> Create Database Payroll_Service;
Query OK, 1 row affected (0.00 sec)

mysql> show databases;
+--------------------+
| Database           |
+--------------------+
| information_schema |
| mysql              |
| payroll_service    |
| performance_schema |
| sakila             |
| sys                |
| world              |
+--------------------+
7 rows in set (0.00 sec)


------------------------------------------------------------------------------------------------


UC2 :- Ability to create a employee payroll table in the payroll service database to
manage employee payrolls.
================================================================================================

mysql> use payroll_service;
Database changed
mysql> create table employee_payroll(
    -> id INT unsigned NOT NULL AUTO_INCREMENT,
    -> name VARCHAR(15) NOT NULL,
    ->  salary Double NOT NULL,
    -> start DATE NOT NULL,
    -> PRIMARY KEY(id));
Query OK, 0 rows affected (0.03 sec)

mysql> show tables;
+---------------------------+
| Tables_in_payroll_service |
+---------------------------+
| employee_payroll          |
+---------------------------+
1 row in set (0.00 sec)

mysql> desc employee_payroll;
+--------+--------------+------+-----+---------+----------------+
| Field  | Type         | Null | Key | Default | Extra          |
+--------+--------------+------+-----+---------+----------------+
| id     | int unsigned | NO   | PRI | NULL    | auto_increment |
| name   | varchar(15)  | NO   |     | NULL    |                |
| salary | double       | NO   |     | NULL    |                |
| start  | date         | NO   |     | NULL    |                |
+--------+--------------+------+-----+---------+----------------+
4 rows in set (0.01 sec)


---------------------------------------------------------------------------------------------------

UC3 :- Ability to create employee payroll data in the payroll service database as 
part of CRUD Operation - Use payroll_service database.

====================================================================================================

mysql> insert into Employee_payroll(name,salary,start)values
    -> ('Mansi','40000.00','2022-09-10'),
    -> ('Shivani','30000.00','2021-08-24'),
    -> ('Surabhi','50000','2023-01-15');
Query OK, 3 rows affected (0.02 sec)
Records: 3  Duplicates: 0  Warnings: 0

mysql> select * from employee_payroll;
+----+---------+--------+------------+
| id | name    | salary | start      |
+----+---------+--------+------------+
|  1 | Mansi   |  40000 | 2022-09-10 |
|  2 | Shivani |  30000 | 2021-08-24 |
|  3 | Surabhi |  50000 | 2023-01-15 |
+----+---------+--------+------------+
3 rows in set (0.00 sec)


-----------------------------------------------------------------------------------------------------

<<<<<<< uc4_RetrieveAllTheEmployee

uc4 :- Ability to retrieve all the employee payroll data that 
is added to payroll service database.

=======================================================================================================

mysql> select * from employee_payroll;
+----+---------+--------+------------+
| id | name    | salary | start      |
+----+---------+--------+------------+
|  1 | Mansi   |  40000 | 2022-09-10 |
|  2 | Shivani |  30000 | 2021-08-24 |
|  3 | Surabhi |  50000 | 2023-01-15 |
+----+---------+--------+------------+
3 rows in set (0.00 sec)

-------------------------------------------------------------------------------------------------------

UC5 :- Ability to retrieve salary data for a particular employee as well as all employees who 
have joined in a particular data range from the payroll service database.

=====================================================================================================

mysql> select * from employee_payroll where name = 'Surabhi';
+----+---------+--------+------------+
| id | name    | salary | start      |
+----+---------+--------+------------+
|  3 | Surabhi |  50000 | 2023-01-15 |
+----+---------+--------+------------+
1 row in set (0.00 sec)

mysql> select * from Employee_Payroll where start between cast('2022-01-01' as DATE) and DATE(NOW());
+----+---------+--------+------------+
| id | name    | salary | start      |
+----+---------+--------+------------+
|  1 | Mansi   |  40000 | 2022-09-10 |
|  3 | Surabhi |  50000 | 2023-01-15 |
+----+---------+--------+------------+
2 rows in set (0.00 sec)

-------------------------------------------------------------------------------------------------------

UC6 :- Ability to find sum, average, min,max and number of male 
and female employees.

=========================================================================================================

 mysql> insert into Employee_Payroll(name,salary,start)values
    -> ('Ankush','35000.00','2019-07-20');
Query OK, 1 row affected (0.01 sec)

mysql> select * from employee_payroll;
+----+---------+--------+------------+
| id | name    | salary | start      |
+----+---------+--------+------------+
|  1 | Mansi   |  40000 | 2022-09-10 |
|  2 | Shivani |  30000 | 2021-08-24 |
|  3 | Surabhi |  50000 | 2023-01-15 |
|  4 | Ankush  |  35000 | 2019-07-20 |
+----+---------+--------+------------+
4 rows in set (0.00 sec)

mysql> alter table Employee_Payroll add gender VARCHAR(6) after name;
Query OK, 0 rows affected (0.02 sec)
Records: 0  Duplicates: 0  Warnings: 0

mysql>  update Employee_Payroll set gender = 'Female' where name = 'Mansi' o
r name = 'Shivani' or name = 'Surabhi';
Query OK, 3 rows affected (0.00 sec)
Rows matched: 3  Changed: 3  Warnings: 0

mysql>  update Employee_Payroll set gender = 'Male' where  name = 'Ankush';
Query OK, 1 row affected (0.00 sec)
Rows matched: 1  Changed: 1  Warnings: 0

mysql> select * from employee_payroll;
+----+---------+--------+--------+------------+
| id | name    | gender | salary | start      |
+----+---------+--------+--------+------------+
|  1 | Mansi   | Female |  40000 | 2022-09-10 |
|  2 | Shivani | Female |  30000 | 2021-08-24 |
|  3 | Surabhi | Female |  50000 | 2023-01-15 |
|  4 | Ankush  | Male   |  35000 | 2019-07-20 |
+----+---------+--------+--------+------------+
4 rows in set (0.00 sec)

--------------------------------------------------------------------------------------------------------

UC7:- Ability to find sum, average, min,max and number of male 
and female employees.

=========================================================================================================

select * from employee_payroll' at line 1
mysql>  select SUM(salary) from Employee_Payroll
    ->  where gender = 'Female' GROUP BY gender;
+-------------+
| SUM(salary) |
+-------------+
|      120000 |
+-------------+
1 row in set (0.00 sec)

mysql>  select SUM(salary) from Employee_Payroll
    -> where gender = 'Male' GROUP BY gender;
+-------------+
| SUM(salary) |
+-------------+
|       35000 |
+-------------+
1 row in set (0.00 sec)

mysql>  select AVG(salary) from Employee_Payroll
    ->  GROUP BY gender;
+-------------+
| AVG(salary) |
+-------------+
|       40000 |
|       35000 |
+-------------+
2 rows in set (0.00 sec)

mysql> select MIN(salary) from Employee_Payroll GROUP BY gender;
+-------------+
| MIN(salary) |
+-------------+
|       30000 |
|       35000 |
+-------------+
2 rows in set (0.00 sec)

mysql> select MAX(salary) from Employee_Payroll GROUP BY gender;
+-------------+
| MAX(salary) |
+-------------+
|       50000 |
|       35000 |
+-------------+
2 rows in set (0.00 sec)

mysql> select COUNT(id) from Employee_Payroll GROUP BY gender;
+-----------+
| COUNT(id) |
+-----------+
|         3 |
|         1 |
+-----------+
2 rows in set (0.00 sec)

----------------------------------------------------------------------------------------------------------

UC8 :- Ability to extend employee_payroll data to store  employee information like employee phone, 
address and department.

=======================================================================================================


mysql> select * from employee_payroll;
+----+---------+--------+--------+------------+
| id | name    | gender | salary | start      |
+----+---------+--------+--------+------------+
|  1 | Mansi   | Female |  40000 | 2022-09-10 |
|  2 | Shivani | Female |  30000 | 2021-08-24 |
|  3 | Surabhi | Female |  50000 | 2023-01-15 |
|  4 | Ankush  | Male   |  35000 | 2019-07-20 |
+----+---------+--------+--------+------------+
4 rows in set (0.01 sec)

mysql>  alter table employee_payroll
    ->  add phoneNumber INT(10) after name;
Query OK, 0 rows affected, 1 warning (0.02 sec)
Records: 0  Duplicates: 0  Warnings: 1

mysql> alter table employee_payroll
    ->  add address Varchar(20) NOT NULL after PhoneNumber;
Query OK, 0 rows affected (0.01 sec)
Records: 0  Duplicates: 0  Warnings: 0

mysql> alter table employee_payroll
    ->  add department Varchar(20) NOT NULL after Address;
Query OK, 0 rows affected (0.01 sec)
Records: 0  Duplicates: 0  Warnings: 0

mysql>  alter table employee_payroll
    -> alter address SET DEFAULT 'Bramhapuri';
Query OK, 0 rows affected (0.01 sec)
Records: 0  Duplicates: 0  Warnings: 0

mysql> desc employee_payroll;
+-------------+--------------+------+-----+------------+----------------+
| Field       | Type         | Null | Key | Default    | Extra          |
+-------------+--------------+------+-----+------------+----------------+
| id          | int unsigned | NO   | PRI | NULL       | auto_increment |
| name        | varchar(15)  | NO   |     | NULL       |                |
| phoneNumber | int          | YES  |     | NULL       |                |
| address     | varchar(20)  | NO   |     | Bramhapuri |                |
| department  | varchar(20)  | NO   |     | NULL       |                |
| gender      | varchar(6)   | YES  |     | NULL       |                |
| salary      | double       | NO   |     | NULL       |                |
| start       | date         | NO   |     | NULL       |                |
+-------------+--------------+------+-----+------------+----------------+
8 rows in set (0.01 sec)

mysql> select * from employee_payroll;
+----+---------+-------------+---------+------------+--------+--------+------------+
| id | name    | phoneNumber | address | department | gender | salary | start      |
+----+---------+-------------+---------+------------+--------+--------+------------+
|  1 | Mansi   |        NULL |         |            | Female |  40000 | 2022-09-10 |
|  2 | Shivani |        NULL |         |            | Female |  30000 | 2021-08-24 |
|  3 | Surabhi |        NULL |         |            | Female |  50000 | 2023-01-15 |
|  4 | Ankush  |        NULL |         |            | Male   |  35000 | 2019-07-20 |
+----+---------+-------------+---------+------------+--------+--------+------------+
4 rows in set (0.00 sec)

mysql> alter table employee_payroll
    ->  modify phonenumber
    -> Varchar(20);
Query OK, 4 rows affected (0.02 sec)
Records: 4  Duplicates: 0  Warnings: 0

mysql> update employee_payroll set phonenumber = '9765935131'
    ->  where name = 'Mansi';
Query OK, 1 row affected (0.00 sec)
Rows matched: 1  Changed: 1  Warnings: 0

mysql> update employee_payroll set phonenumber = '9765940347'
    ->  where name = 'shivani';
Query OK, 1 row affected (0.00 sec)
Rows matched: 1  Changed: 1  Warnings: 0

mysql> update employee_payroll set phonenumber = '9421869425'
    ->  where name = 'Surabhi';
Query OK, 1 row affected (0.00 sec)
Rows matched: 1  Changed: 1  Warnings: 0

mysql> update employee_payroll set phonenumber = '9634069359'
    ->  where name = 'Ankush';
Query OK, 1 row affected (0.00 sec)
Rows matched: 1  Changed: 1  Warnings: 0

mysql> select * from employee_payroll;
+----+---------+-------------+---------+------------+--------+--------+------------+
| id | name    | phonenumber | address | department | gender | salary | start      |
+----+---------+-------------+---------+------------+--------+--------+------------+
|  1 | Mansi   | 9765935131  |         |            | Female |  40000 | 2022-09-10 |
|  2 | Shivani | 9765940347  |         |            | Female |  30000 | 2021-08-24 |
|  3 | Surabhi | 9421869425  |         |            | Female |  50000 | 2023-01-15 |
|  4 | Ankush  | 9634069359  |         |            | Male   |  35000 | 2019-07-20 |
+----+---------+-------------+---------+------------+--------+--------+------------+
4 rows in set (0.00 sec)

mysql> update employee_payroll set address = 'Bramhapuri'
    ->  where name = 'Mansi' or name = 'Shivani' or name = 'Surabhi' or name = 'Ankush';
Query OK, 4 rows affected (0.00 sec)
Rows matched: 4  Changed: 4  Warnings: 0

mysql> select * from employee_payroll;
+----+---------+-------------+------------+------------+--------+--------+------------+
| id | name    | phonenumber | address    | department | gender | salary | start      |
+----+---------+-------------+------------+------------+--------+--------+------------+
|  1 | Mansi   | 9765935131  | Bramhapuri |            | Female |  40000 | 2022-09-10 |
|  2 | Shivani | 9765940347  | Bramhapuri |            | Female |  30000 | 2021-08-24 |
|  3 | Surabhi | 9421869425  | Bramhapuri |            | Female |  50000 | 2023-01-15 |
|  4 | Ankush  | 9634069359  | Bramhapuri |            | Male   |  35000 | 2019-07-20 |
+----+---------+-------------+------------+------------+--------+--------+------------+
4 rows in set (0.00 sec)

mysql> update employee_payroll set department = 'Devops Engineer'
    -> where name = 'Mansi';
Query OK, 1 row affected (0.00 sec)
Rows matched: 1  Changed: 1  Warnings: 0

mysql> update employee_payroll set department = 'Design Engineer'
    -> where name = 'shivani';
Query OK, 1 row affected (0.00 sec)
Rows matched: 1  Changed: 1  Warnings: 0

mysql> update employee_payroll set department = 'Manual Testing'
    -> where name = 'Surabhi';
Query OK, 1 row affected (0.00 sec)
Rows matched: 1  Changed: 1  Warnings: 0

mysql> update employee_payroll set department = 'Python Developer'
    -> where name = 'Ankush';
Query OK, 1 row affected (0.00 sec)
Rows matched: 1  Changed: 1  Warnings: 0

mysql> select * from employee_payroll;
+----+---------+-------------+------------+------------------+--------+--------+------------+
| id | name    | phonenumber | address    | department       | gender | salary | start      |
+----+---------+-------------+------------+------------------+--------+--------+------------+
|  1 | Mansi   | 9765935131  | Bramhapuri | Devops Engineer  | Female |  40000 | 2022-09-10 |
|  2 | Shivani | 9765940347  | Bramhapuri | Design Engineer  | Female |  30000 | 2021-08-24 |
|  3 | Surabhi | 9421869425  | Bramhapuri | Manual Testing   | Female |  50000 | 2023-01-15 |
|  4 | Ankush  | 9634069359  | Bramhapuri | Python Developer | Male   |  35000 | 2019-07-20 |
+----+---------+-------------+------------+------------------+--------+--------+------------+
4 rows in set (0.00 sec)

------------------------------------------------------------------------------------------------------------------------------------------------------------


UC9 :- Ability to extend employee_payroll table to have Basic Pay,Deductions, Taxable Pay,Income Tax, Net Pay

============================================================================================================================================================


mysql> alter table employee_payroll add basicpay Double NOT NULL after salary;
Query OK, 0 rows affected (0.01 sec)
Records: 0  Duplicates: 0  Warnings: 0

mysql> alter table employee_payroll add deduction Double NOT NULL after basicpay;
Query OK, 0 rows affected (0.01 sec)
Records: 0  Duplicates: 0  Warnings: 0

mysql> alter table employee_payroll add taxablepay Double NOT NULL after deduction;
Query OK, 0 rows affected (0.01 sec)
Records: 0  Duplicates: 0  Warnings: 0

mysql> alter table employee_payroll add incometax Double NOT NULL after taxablepay;
Query OK, 0 rows affected (0.01 sec)
Records: 0  Duplicates: 0  Warnings: 0

mysql>  alter table employee_payroll add netpay Double NOT NULL after incometax;
Query OK, 0 rows affected (0.01 sec)
Records: 0  Duplicates: 0  Warnings: 0

mysql> desc employee_payroll;
+-------------+--------------+------+-----+------------+----------------+
| Field       | Type         | Null | Key | Default    | Extra          |
+-------------+--------------+------+-----+------------+----------------+
| id          | int unsigned | NO   | PRI | NULL       | auto_increment |
| name        | varchar(15)  | NO   |     | NULL       |                |
| phonenumber | varchar(20)  | YES  |     | NULL       |                |
| address     | varchar(20)  | NO   |     | Bramhapuri |                |
| department  | varchar(20)  | NO   |     | NULL       |                |
| gender      | varchar(6)   | YES  |     | NULL       |                |
| salary      | double       | NO   |     | NULL       |                |
| basicpay    | double       | NO   |     | NULL       |                |
| deduction   | double       | NO   |     | NULL       |                |
| taxablepay  | double       | NO   |     | NULL       |                |
| incometax   | double       | NO   |     | NULL       |                |
| netpay      | double       | NO   |     | NULL       |                |
| start       | date         | NO   |     | NULL       |                |
+-------------+--------------+------+-----+------------+----------------+
13 rows in set (0.00 sec)

mysql> select * from employee_payroll;
+----+---------+-------------+------------+------------------+--------+--------+----------+-----------+------------+-----------+--------+------------+
| id | name    | phonenumber | address    | department       | gender | salary | basicpay | deduction | taxablepay | incometax | netpay | start      |
+----+---------+-------------+------------+------------------+--------+--------+----------+-----------+------------+-----------+--------+------------+
|  1 | Mansi   | 9765935131  | Bramhapuri | Devops Engineer  | Female |  40000 |        0 |         0 |          0 |         0 |      0 | 2022-09-10 |
|  2 | Shivani | 9765940347  | Bramhapuri | Design Engineer  | Female |  30000 |        0 |         0 |          0 |         0 |      0 | 2021-08-24 |
|  3 | Surabhi | 9421869425  | Bramhapuri | Manual Testing   | Female |  50000 |        0 |         0 |          0 |         0 |      0 | 2023-01-15 |
|  4 | Ankush  | 9634069359  | Bramhapuri | Python Developer | Male   |  35000 |        0 |         0 |          0 |         0 |      0 | 2019-07-20 |
+----+---------+-------------+------------+------------------+--------+--------+----------+-----------+------------+-----------+--------+------------+
4 rows in set (0.00 sec)

mysql> update employee_payroll set basicpay = '20000', deduction = '3000', taxablepay = '2000', incometax = '2600', netpay = '12400'
    -> where name  = 'Mansi';
Query OK, 1 row affected (0.00 sec)
Rows matched: 1  Changed: 1  Warnings: 0

mysql> update employee_payroll set basicpay = '30000', deduction = '3000', taxablepay = '2500', incometax = '2700', netpay = '14600'
    -> where name  = 'Shivani';
Query OK, 1 row affected (0.00 sec)
Rows matched: 1  Changed: 1  Warnings: 0

mysql> update employee_payroll set basicpay = '35000', deduction = '3200', taxablepay = '2600', incometax = '2800', netpay = '15700'
    -> where name  = 'Surabhi';
Query OK, 1 row affected (0.01 sec)
Rows matched: 1  Changed: 1  Warnings: 0

mysql> update employee_payroll set basicpay = '40000', deduction = '3500', taxablepay = '2700', incometax = '3000', netpay = '16000'
    -> where name  = 'Ankush';
Query OK, 0 rows affected (0.00 sec)
Rows matched: 1  Changed: 0  Warnings: 0

mysql> select * from employee_payroll;
+----+---------+-------------+------------+------------------+--------+--------+----------+-----------+------------+-----------+--------+------------+
| id | name    | phonenumber | address    | department       | gender | salary | basicpay | deduction | taxablepay | incometax | netpay | start      |
+----+---------+-------------+------------+------------------+--------+--------+----------+-----------+------------+-----------+--------+------------+
|  1 | Mansi   | 9765935131  | Bramhapuri | Devops Engineer  | Female |  40000 |    20000 |      3000 |       2000 |      2600 |  12400 | 2022-09-10 |
|  2 | Shivani | 9765940347  | Bramhapuri | Design Engineer  | Female |  30000 |    30000 |      3000 |       2500 |      2700 |  14600 | 2021-08-24 |
|  3 | Surabhi | 9421869425  | Bramhapuri | Manual Testing   | Female |  50000 |    35000 |      3200 |       2600 |      2800 |  15700 | 2023-01-15 |
|  4 | Ankush  | 9634069359  | Bramhapuri | Python Developer | Male   |  35000 |    40000 |      3500 |       2700 |      3000 |  16000 | 2019-07-20 |
+----+---------+-------------+------------+------------------+--------+--------+----------+-----------+------------+-----------+--------+------------+
4 rows in set (0.00 sec)

-----------------------------------------------------------------------------------------------------------------------------------------------------------------

UC10 :- Ability to make Terissa as part of Sales and Marketing Department
- Note: The Complete employee payroll roll need to be Inserted 
If a Salary is now going to be updated multiple rows has to be updated
creating unnecessary redundancy
- Further There is 2 Employee ID so according to Database there is two
different Terissa'
===================================================================================================================================================================

mysql> select * from employee_payroll;
+----+---------+-------------+------------+------------------+--------+--------+----------+-----------+------------+-----------+--------+------------+
| id | name    | phonenumber | address    | department       | gender | salary | basicpay | deduction | taxablepay | incometax | netpay | start      |
+----+---------+-------------+------------+------------------+--------+--------+----------+-----------+------------+-----------+--------+------------+
|  1 | Mansi   | 9765935131  | Bramhapuri | Devops Engineer  | Female |  40000 |    20000 |      3000 |       2000 |      2600 |  12400 | 2022-09-10 |
|  2 | Shivani | 9765940347  | Bramhapuri | Design Engineer  | Female |  30000 |    30000 |      3000 |       2500 |      2700 |  14600 | 2021-08-24 |
|  3 | Surabhi | 9421869425  | Bramhapuri | Manual Testing   | Female |  50000 |    35000 |      3200 |       2600 |      2800 |  15700 | 2023-01-15 |
|  4 | Ankush  | 9634069359  | Bramhapuri | Python Developer | Male   |  35000 |    40000 |      3500 |       2700 |      3000 |  16000 | 2019-07-20 |
+----+---------+-------------+------------+------------------+--------+--------+----------+-----------+------------+-----------+--------+------------+
4 rows in set (0.00 sec)

mysql> insert into employee_payroll(name,phonenumber,address,department,gender,salary,basicpay,deduction,taxablepay,incometax,netpay,start) values
    -> ('Terisa','7719244417','Mumbai','Sales','Female',26000.00,20000.00,2000.00,1200.00,1200.00,12800.00,'2022-6-23');
Query OK, 1 row affected (0.01 sec)

mysql> select * from employee_payroll;
+----+---------+-------------+------------+------------------+--------+--------+----------+-----------+------------+-----------+--------+------------+
| id | name    | phonenumber | address    | department       | gender | salary | basicpay | deduction | taxablepay | incometax | netpay | start      |
+----+---------+-------------+------------+------------------+--------+--------+----------+-----------+------------+-----------+--------+------------+
|  1 | Mansi   | 9765935131  | Bramhapuri | Devops Engineer  | Female |  40000 |    20000 |      3000 |       2000 |      2600 |  12400 | 2022-09-10 |
|  2 | Shivani | 9765940347  | Bramhapuri | Design Engineer  | Female |  30000 |    30000 |      3000 |       2500 |      2700 |  14600 | 2021-08-24 |
|  3 | Surabhi | 9421869425  | Bramhapuri | Manual Testing   | Female |  50000 |    35000 |      3200 |       2600 |      2800 |  15700 | 2023-01-15 |
|  4 | Ankush  | 9634069359  | Bramhapuri | Python Developer | Male   |  35000 |    40000 |      3500 |       2700 |      3000 |  16000 | 2019-07-20 |
|  5 | Terisa  | 7719244417  | Mumbai     | Sales            | Female |  26000 |    20000 |      2000 |       1200 |      1200 |  12800 | 2022-06-23 |
+----+---------+-------------+------------+------------------+--------+--------+----------+-----------+------------+-----------+--------+------------+
5 rows in set (0.00 sec)

mysql> insert into employee_payroll(name,phonenumber,address,department,gender,salary,basicpay,deduction,taxablepay,incometax,netpay,start) values
    -> ('Terisa','8656342412','Delhi','Full Stack','Female',30000.00,30000.00,3000.00,1300.00,1300.00,13800.00,'2023-6-23');
Query OK, 1 row affected (0.00 sec)

mysql> select * from employee_payroll;
+----+---------+-------------+------------+------------------+--------+--------+----------+-----------+------------+-----------+--------+------------+
| id | name    | phonenumber | address    | department       | gender | salary | basicpay | deduction | taxablepay | incometax | netpay | start      |
+----+---------+-------------+------------+------------------+--------+--------+----------+-----------+------------+-----------+--------+------------+
|  1 | Mansi   | 9765935131  | Bramhapuri | Devops Engineer  | Female |  40000 |    20000 |      3000 |       2000 |      2600 |  12400 | 2022-09-10 |
|  2 | Shivani | 9765940347  | Bramhapuri | Design Engineer  | Female |  30000 |    30000 |      3000 |       2500 |      2700 |  14600 | 2021-08-24 |
|  3 | Surabhi | 9421869425  | Bramhapuri | Manual Testing   | Female |  50000 |    35000 |      3200 |       2600 |      2800 |  15700 | 2023-01-15 |
|  4 | Ankush  | 9634069359  | Bramhapuri | Python Developer | Male   |  35000 |    40000 |      3500 |       2700 |      3000 |  16000 | 2019-07-20 |
|  5 | Terisa  | 7719244417  | Mumbai     | Sales            | Female |  26000 |    20000 |      2000 |       1200 |      1200 |  12800 | 2022-06-23 |
|  6 | Terisa  | 8656342412  | Delhi      | Full Stack       | Female |  30000 |    30000 |      3000 |       1300 |      1300 |  13800 | 2023-06-23 |
+----+---------+-------------+------------+------------------+--------+--------+----------+-----------+------------+-----------+--------+------------+
6 rows in set (0.00 sec)

mysql>  select * from employee_payroll where name = 'Terisa';
+----+--------+-------------+---------+------------+--------+--------+----------+-----------+------------+-----------+--------+------------+
| id | name   | phonenumber | address | department | gender | salary | basicpay | deduction | taxablepay | incometax | netpay | start      |
+----+--------+-------------+---------+------------+--------+--------+----------+-----------+------------+-----------+--------+------------+
|  5 | Terisa | 7719244417  | Mumbai  | Sales      | Female |  26000 |    20000 |      2000 |       1200 |      1200 |  12800 | 2022-06-23 |
|  6 | Terisa | 8656342412  | Delhi   | Full Stack | Female |  30000 |    30000 |      3000 |       1300 |      1300 |  13800 | 2023-06-23 |
+----+--------+-------------+---------+------------+--------+--------+----------+-----------+------------+-----------+--------+------------+
2 rows in set (0.00 sec)

-------------------------------------------------------------------------------------------------------------------------------------------------------------------









